{
  "schema_version": 1,
  "skill": "iteration-close",
  "run_id": "20260707T011428Z",
  "started_at": "2026-07-07T01:14:28.239303Z",
  "plan_id": "kg-ideate-skill",
  "task_id": "t1-kg-brief-molecule",
  "agent_type": "loop-worker",
  "lifecycle_point": "skill_entry",
  "expected_artifacts": [
    ".agents/active/iteration-log/iter-67.yaml",
    ".agents/active/merge-back/t1-kg-brief-molecule.md"
  ],
  "context": {
    "git_head_at_start": "a4ec27132b9d7d9a042c31fe5869d22da3435ab7",
    "write_scope": [
      "internal/scaffold/home/starter/skills/global/kg-ideate/kg-brief"
    ]
  }
}
